{
  "format": "palo-maturity-catalog",
  "version": "1.0.0",
  "title": "PALO Two-Lens AI Maturity Assessment",
  "status": "experimental-local-assessment",
  "publishedAt": "2026-10-21",
  "methodology": "Evidence-bounded ordinal profile; no national ranking, certification or authorization. PALO-designed rubric, not BCG ASPIRE scoring.",
  "levels": [
    {
      "value": 0,
      "label": "Absent",
      "description": "Evidence records that the capability is absent in scope."
    },
    {
      "value": 1,
      "label": "Documented",
      "description": "Named ownership, boundaries and procedures are documented."
    },
    {
      "value": 2,
      "label": "Tested",
      "description": "A repeatable test demonstrates the capability in the stated scope."
    },
    {
      "value": 3,
      "label": "Monitored",
      "description": "Repeated operational observations and change responses are recorded."
    },
    {
      "value": 4,
      "label": "Challenged and improved",
      "description": "Independent challenge, contrary evidence and verified improvement are recorded."
    }
  ],
  "evidenceTypes": [
    {
      "id": "none",
      "label": "No evidence",
      "cap": null
    },
    {
      "id": "declared",
      "label": "Self-declared only",
      "cap": null
    },
    {
      "id": "documented",
      "label": "Documented record",
      "cap": 1
    },
    {
      "id": "tested",
      "label": "Test record",
      "cap": 2
    },
    {
      "id": "monitored",
      "label": "Repeated observation",
      "cap": 3
    },
    {
      "id": "independent",
      "label": "Independent review and improvement",
      "cap": 4
    }
  ],
  "domains": [
    {
      "id": "deployment",
      "title": "Deployment capability",
      "lens": "deployment",
      "description": "Can this scoped organization or system turn AI plans into working capability?"
    },
    {
      "id": "institutional",
      "title": "Institutional capability",
      "lens": "governance",
      "description": "Can accountable people supervise, challenge and correct the system?"
    },
    {
      "id": "authority",
      "title": "Delegated authority",
      "lens": "governance",
      "description": "Who may decide or act, under which limits and revocation conditions?"
    },
    {
      "id": "behaviour",
      "title": "Observable behaviour",
      "lens": "governance",
      "description": "Can actual behaviour, effects and harms be observed and corrected?"
    },
    {
      "id": "evidence",
      "title": "Verifiable evidence",
      "lens": "governance",
      "description": "Can claims be traced, challenged and refreshed over time?"
    }
  ],
  "questions": [
    {
      "id": "D1",
      "domain": "deployment",
      "title": "Purpose and delivery ownership",
      "prompt": "Are intended value, prohibited uses, accountable owners and delivery decisions explicit?",
      "evidence": "Approved purpose and delivery record, delivery review and outcome sample.",
      "action": "Assign a delivery owner and verify intended value against a scoped pilot.",
      "gate": "frame",
      "controlIds": [
        "ctrl-purpose-boundary"
      ],
      "critical": false
    },
    {
      "id": "D2",
      "domain": "deployment",
      "title": "Practical skills",
      "prompt": "Can operators, engineers and reviewers demonstrate the skills needed for their roles?",
      "evidence": "Role competence matrix, observed tasks and refresher results.",
      "action": "Test role competence with realistic tasks, then close the observed gaps.",
      "gate": "control",
      "controlIds": [
        "ctrl-ai-literacy-effectiveness"
      ],
      "critical": false
    },
    {
      "id": "D3",
      "domain": "deployment",
      "title": "Data and infrastructure",
      "prompt": "Are data, compute, access and recovery available at the required quality and scale?",
      "evidence": "Data fitness results, capacity measurements and restore tests.",
      "action": "Validate data fitness, capacity and recovery against the intended operating envelope.",
      "gate": "assess",
      "controlIds": [
        "ctrl-data-provenance"
      ],
      "critical": false
    },
    {
      "id": "D4",
      "domain": "deployment",
      "title": "Sustainable delivery resources",
      "prompt": "Can the team fund and operate the capability over its intended lifecycle?",
      "evidence": "Operating budget, support ownership and measured service capacity.",
      "action": "Document lifecycle cost and staffed operational capacity.",
      "gate": "frame",
      "controlIds": [
        "ctrl-aims-leadership-objectives"
      ],
      "critical": false
    },
    {
      "id": "D5",
      "domain": "deployment",
      "title": "Evaluation and improvement",
      "prompt": "Can the team validate performance and introduce improvements reproducibly?",
      "evidence": "Versioned evaluation set, release comparison and failed-test records.",
      "action": "Define representative evaluations and a repeatable release review.",
      "gate": "measure",
      "controlIds": [
        "ctrl-adversarial-testing",
        "ctrl-change-gate"
      ],
      "critical": false
    },
    {
      "id": "D6",
      "domain": "deployment",
      "title": "Dependency resilience",
      "prompt": "Can the organization continue or exit when a model, supplier or infrastructure dependency changes?",
      "evidence": "Dependency map, portability exercise and exit or continuity test.",
      "action": "Exercise an exit or continuity scenario for a material dependency.",
      "gate": "control",
      "controlIds": [
        "ctrl-third-party-due-diligence"
      ],
      "critical": false
    },
    {
      "id": "I1",
      "domain": "institutional",
      "title": "Accountable oversight",
      "prompt": "Do named reviewers have the authority, time and competence to intervene?",
      "evidence": "Mandate, reviewer competence test and intervention record.",
      "action": "Name the accountable reviewer and test an intervention under realistic conditions.",
      "gate": "control",
      "controlIds": [
        "ctrl-human-review"
      ],
      "critical": true
    },
    {
      "id": "I2",
      "domain": "institutional",
      "title": "Independent challenge",
      "prompt": "Can reviewers challenge a deployment decision and track corrective action without conflicts of interest?",
      "evidence": "Challenge minutes, conflict declaration and closed corrective-action sample.",
      "action": "Run a challenge session and assign independently reviewed corrective actions.",
      "gate": "prove",
      "controlIds": [
        "ctrl-aims-internal-audit",
        "ctrl-aims-management-review-capa"
      ],
      "critical": false
    },
    {
      "id": "I3",
      "domain": "institutional",
      "title": "Affected people and remedy",
      "prompt": "Can affected people understand an outcome, contest it and obtain a reasoned remedy?",
      "evidence": "Accessible notice, appeal journey, independent review and verified closure sample.",
      "action": "Test the notice, appeal and remedy journey with representative affected people.",
      "gate": "prove",
      "controlIds": [
        "ctrl-appeal-remedy",
        "ctrl-ai-output-accessibility"
      ],
      "critical": true
    },
    {
      "id": "I4",
      "domain": "institutional",
      "title": "Dependency and policy accountability",
      "prompt": "Are supplier commitments and policy changes reviewed for relevance with an owner and deadline?",
      "evidence": "Versioned supplier terms, PolicyWatcher or other source observation, human applicability decision and exit owner.",
      "action": "Review one material supplier or policy change and record its scoped control impact.",
      "gate": "classify",
      "controlIds": [
        "ctrl-third-party-due-diligence",
        "ctrl-change-gate"
      ],
      "critical": false
    },
    {
      "id": "A1",
      "domain": "authority",
      "title": "Explicit decision boundaries",
      "prompt": "Are permitted and prohibited decisions, resources, data uses and delegation limits explicit?",
      "evidence": "Authority mandate, Action Claim or equivalent scoped decision record and negative tests.",
      "action": "Document and test authority boundaries, including advisory-only limits.",
      "gate": "frame",
      "controlIds": [
        "ctrl-purpose-boundary",
        "ctrl-agentic-authority"
      ],
      "critical": true
    },
    {
      "id": "A2",
      "domain": "authority",
      "title": "Approval and separation of duties",
      "prompt": "Are consequential decisions tied to a specific current request and authorized independent review?",
      "evidence": "Approval-to-request binding, role separation and stale-approval rejection test.",
      "action": "Bind approvals to exact requests and test unauthorized or stale reuse.",
      "gate": "control",
      "controlIds": [
        "ctrl-human-review",
        "ctrl-agentic-authority"
      ],
      "critical": true
    },
    {
      "id": "A3",
      "domain": "authority",
      "title": "Revocation and containment",
      "prompt": "Can humans stop or restrict the system and demonstrate that revoked authority no longer works?",
      "evidence": "Revocation drill, denial records and authoritative stop observation.",
      "action": "Test revocation, containment and any remaining direct execution paths.",
      "gate": "control",
      "controlIds": [
        "ctrl-agentic-authority",
        "ctrl-runtime-production-boundary"
      ],
      "critical": true
    },
    {
      "id": "A4",
      "domain": "authority",
      "title": "Change and delegation continuity",
      "prompt": "Do model, prompt, memory, tool and subagent changes trigger review of inherited authority?",
      "evidence": "Version-bound change review, delegation chain and regression evidence.",